{
  "$schema": "https://json-schema.org/draft/2020-12/schema",
  "$id": "urn:agent-dispatch:schema:sync-verification:v1",
  "title": "Agent Dispatch pair verification v1",
  "type": "object", "additionalProperties": false,
  "required": ["schema_version", "verification_id", "group_id", "membership_revision", "content_ref", "target_commit", "scope_digest", "contract_digest", "phase", "result", "expected_nodes", "nodes", "fence", "retain_until_resolved"],
  "properties": {
    "schema_version": {"const": "agent-dispatch.sync-verification/v1"}, "verification_id": {"$ref": "#/$defs/id"}, "group_id": {"$ref": "#/$defs/group"},
    "membership_revision": {"$ref": "#/$defs/oid"}, "content_ref": {"type": "string", "pattern": "^refs/heads/[A-Za-z0-9](?:[A-Za-z0-9._/-]*[A-Za-z0-9])?$"}, "target_commit": {"$ref": "#/$defs/oid"},
    "scope_digest": {"$ref": "#/$defs/digest"}, "contract_digest": {"$ref": "#/$defs/digest"},
    "phase": {"enum": ["planned", "collecting", "finished"]}, "result": {"enum": ["pending", "complete", "incomplete", "target_changed", "blocked", "expired"]},
    "expected_nodes": {"type": "array", "minItems": 2, "maxItems": 2, "items": {"$ref": "#/$defs/expectedNode"}},
    "nodes": {"type": "array", "minItems": 2, "maxItems": 2, "items": {"type": "object", "additionalProperties": false, "required": ["instance_id", "state_incarnation_id", "membership_revision", "content_ref", "target_commit", "scope_digest", "contract_digest", "nonce", "state", "evidence_generation", "evidence_age_seconds", "governed_dirty", "pending_work", "membership_current", "evidence_fresh", "uncertain"], "properties": {"instance_id": {"$ref": "#/$defs/group"}, "state_incarnation_id": {"type": "string", "pattern": "^[a-z0-9][a-z0-9-]{7,127}$"}, "membership_revision": {"$ref": "#/$defs/oid"}, "content_ref": {"type": "string", "pattern": "^refs/heads/[A-Za-z0-9](?:[A-Za-z0-9._/-]*[A-Za-z0-9])?$"}, "target_commit": {"$ref": "#/$defs/oid"}, "scope_digest": {"$ref": "#/$defs/digest"}, "contract_digest": {"$ref": "#/$defs/digest"}, "nonce": {"type": "string", "minLength": 16, "maxLength": 128}, "state": {"enum": ["applied", "behind", "ahead", "local_dirty", "joining", "paused", "blocked", "unreachable", "identity_mismatch", "membership_mismatch", "contract_mismatch", "unknown"]}, "evidence_generation": {"type": "integer", "minimum": 1}, "evidence_age_seconds": {"type": "integer", "minimum": 0, "maximum": 86400}, "governed_dirty": {"type": "boolean"}, "pending_work": {"type": "boolean"}, "membership_current": {"type": "boolean"}, "evidence_fresh": {"type": "boolean"}, "uncertain": {"type": "boolean"}}}},
    "fence": {"type": "integer", "minimum": 1}, "retain_until_resolved": {"type": "boolean"}
  },
  "allOf": [
    {"if": {"properties": {"result": {"const": "complete"}}, "required": ["result"]}, "then": {"properties": {"phase": {"const": "finished"}, "retain_until_resolved": {"const": false}, "nodes": {"items": {"properties": {"state": {"const": "applied"}, "evidence_age_seconds": {"maximum": 300}, "governed_dirty": {"const": false}, "pending_work": {"const": false}, "membership_current": {"const": true}, "evidence_fresh": {"const": true}, "uncertain": {"const": false}}}}}}},
    {"if": {"properties": {"result": {"enum": ["pending", "incomplete", "target_changed", "blocked", "expired"]}}, "required": ["result"]}, "then": {"properties": {"retain_until_resolved": {"const": true}}}},
    {"if": {"properties": {"phase": {"enum": ["planned", "collecting"]}}, "required": ["phase"]}, "then": {"properties": {"result": {"enum": ["pending", "incomplete"]}}}},
    {"if": {"properties": {"phase": {"const": "finished"}}, "required": ["phase"]}, "then": {"properties": {"result": {"not": {"const": "pending"}}}}}
  ],
  "$defs": {"id": {"type": "string", "pattern": "^[a-z0-9][a-z0-9-]{0,127}$"}, "group": {"type": "string", "pattern": "^[a-z][a-z0-9-]{0,62}$"}, "oid": {"type": "string", "pattern": "^(?:[0-9a-f]{40}|[0-9a-f]{64})$"}, "digest": {"type": "string", "pattern": "^sha256:[0-9a-f]{64}$"}, "expectedNode": {"type": "object", "additionalProperties": false, "required": ["instance_id", "state_incarnation_id"], "properties": {"instance_id": {"$ref": "#/$defs/group"}, "state_incarnation_id": {"type": "string", "pattern": "^[a-z0-9][a-z0-9-]{7,127}$"}}}}
}
