{"schema_version":"agent-dispatch.sync-verification/v1","verification_id":"verification-collecting-001","group_id":"wiki-pair","membership_revision":"1111111111111111111111111111111111111111","content_ref":"refs/heads/wiki-sync","target_commit":"2222222222222222222222222222222222222222","scope_digest":"sha256:1e134a9296b8652b4fd887c8be2c2596caee32ac0523f058d516af8fd4958320","contract_digest":"sha256:30cf47b1bd854a0271aa9df3e7b37f0cc14cdd86d3f06a65a2cb787c6741131b","phase":"collecting","result":"pending","expected_nodes":[{"instance_id":"node-a","state_incarnation_id":"node-a-0001"},{"instance_id":"node-b","state_incarnation_id":"node-b-0001"}],"nodes":[{"instance_id":"node-a","state_incarnation_id":"node-a-0001","membership_revision":"1111111111111111111111111111111111111111","content_ref":"refs/heads/wiki-sync","target_commit":"2222222222222222222222222222222222222222","scope_digest":"sha256:1e134a9296b8652b4fd887c8be2c2596caee32ac0523f058d516af8fd4958320","contract_digest":"sha256:30cf47b1bd854a0271aa9df3e7b37f0cc14cdd86d3f06a65a2cb787c6741131b","nonce":"0123456789abcdef","state":"applied","evidence_generation":3,"evidence_age_seconds":0,"governed_dirty":false,"pending_work":false,"membership_current":true,"evidence_fresh":true,"uncertain":false}],"fence":9,"retain_until_resolved":true}
